title,description,url,urlToImage
How Much Will the iPhone 16 Cost?,"Apple's next-generation iPhone 16 series is expected to launch on September 20 and will compete in a quickly evolving smartphone market, and with some notable upgrades rumored, the new models could see price changes compared to previous years.





Successive…",https://www.macrumors.com/2024/09/06/how-much-will-iphone-16-cost/,https://images.macrumors.com/t/xcTabKWMzOGvrlv91McWob6xGn0=/2000x/article-new/2024/06/iPhone-16-Pro-Front-Update-Blue.jpg
"I deleted Instagram because it was making me anxious. I have no FOMO now, and I'm closer to my friends.",Over 150 days ago I decided to delete Instagram. I'm more productive now and closer to my friends despite not sharing memes all the time.,https://www.businessinsider.com/deleted-instagram-and-its-helped-anxiety-fomo-productivity-2024-9,https://i.insider.com/66d9e2291d8d2deb96b95d61?width=1200&format=jpeg
"Teens won $50,000 for inventing a flood forecasting technology they hope can help millions of people at risk worldwide",This year's first place Earth Prize went to four teens for developing a new way to visualize flood risk using AI and computer modeling.,https://www.businessinsider.com/teens-win-50000-earth-prize-flood-forecasting-model-2024-8,https://i.insider.com/66cf3b2e43b5e59d16b5f3dc?width=1200&format=jpeg
"Virgin is spending $17 billion on new planes and cabins. See inside its Airbus A330neo, with niche perks like Bluetooth.","Virgin Atlantic's Airbus A330neo debuted with an exclusive ""Retreat Suite"" business class and ditched bars for a new social space called the ""Loft.""",https://www.businessinsider.com/virgin-a330neo-new-business-premium-economy-cabins-bluetooth-2024-9,https://i.insider.com/66da03045444ffafa762d717?width=1200&format=jpeg
Backlash against immigrants challenges Canada's welcoming image,A growing perception in Canada that immigration is to blame for some of the country's economic woes is fuelling a xenophobic backlash evidenced by a surge in...,https://ca.news.yahoo.com/backlash-against-immigrants-challenges-canadas-100523663.html,https://media.zenfs.com/en/reuters.com/7f6d130d18825f384b0c7f6527400aac
Global Warming Breaks Another Record With Hottest Summer Ever,"Across the world, soaring temperatures are testing the limits of the human body, posing threats and even causing deaths at outdoor activities such as concerts, sports events, and religious gatherings.",https://time.com/7018495/hottest-summer-record-heat-extreme-temperatures-global-warming-climate-change/,https://api.time.com/wp-content/uploads/2024/09/turkey-extreme-heat-fire.jpg?quality=85&w=1024&h=628&crop=1
"El gran ""sorpasso"" de China a EEUU ya ha llegado y nos dice mucho sobre la calidad de vida: el consumo de proteínas","Ni en músculo económico, ni en patentes, ni en innovación tecnológica. El gran sorpasso de China sobre Estados Unidos lo marca otro indicador igual de crucial pero algo menos evidente: las proteínas. Los datos recogidos por la FAO, la agencia alimentaria de l…",https://www.xataka.com/magnet/china-ha-logrado-marcarse-sorpasso-estados-unidos-indicador-clave-consumo-proteinas,https://i.blogs.es/f694b5/josh-appel-8q3a_pb8jf0-unsplash/840_560.jpeg
Turn any bike into an e-bike in seconds with this nifty gadget,Innovative startup Clip has developed a gadget to quickly convert a regular bike into an e-bike without tools or complex installations.,https://www.foxnews.com/tech/turn-any-bike-e-bike-seconds-nifty-gadget,https://static.foxnews.com/foxnews.com/content/uploads/2024/09/2-Turn-any-bike-into-an-e-bike-in-seconds-with-this-nifty-gadget.jpg
"Potentially devastating typhoon approaching Hong Kong, disrupting life and business","Super Typhoon Yagi, the second strongest tropical cyclone of 2024, is impacting southern China, once again highlighting Apple's reliance on the country as iPhone 16 launches.Satellite imagery provided by NASA of Yagi with Apple logos indicating factories and …",https://appleinsider.com/articles/24/09/06/potentially-devastating-typhoon-approaching-hong-kong-disrupting-life-and-business,https://photos5.appleinsider.com/gallery/60941-125552-IMG_0890-xl.jpg
Malas noticias: un tifón devastador se acerca al núcleo de fabricación y entrega del iPhone 16,"El iPhone 16 ya se encuentra en la fase final de ensamblaje. Algunos modelos están ya fabricados desde el pasado mes de julio y la producción no cesa para hacer frente a una demanda histórica. Apple  de iPhone 16, una de las mayores previsiones en los últimos…",https://www.applesfera.com/iphone/malas-noticias-tifon-devastador-se-acerca-al-nucleo-fabricacion-entrega-iphone-16,https://i.blogs.es/ddf72b/tifon-iphone/840_560.jpeg
China's mysterious space plane returns to Earth after 268 days in orbit,China's reusable space plane has landed after spending over 8 months in orbit on a largely secret mission.,https://www.space.com/china-space-plane-lands-268-days,https://cdn.mos.cms.futurecdn.net/cGtCuNH7okM3obeutT7Dhk-1200-80.jpg
Witness 1.8 billion years of tectonic plates dance across Earth's surface in a new animation,"Using information from inside the rocks on Earth's surface, we have reconstructed the plate tectonics of the planet over the last 1.8 billion years.",https://phys.org/news/2024-09-witness-billion-years-tectonic-plates.html,https://scx2.b-cdn.net/gfx/news/hires/2022/tectonic-plates.jpg
The FDA has an inspector shortage -- now that the low-paid workers have shifted to the private sector,"Some 2,000 drug-making firms haven’t had their operations inspected by federal regulators in years, as Food and Drug Administration inspectors leave the agency for better jobs in the private sector.Read more...",https://qz.com/fda-inspections-drug-makers-worker-shortage-1851641665,"https://i.kinja-img.com/image/upload/c_fill,h_675,pg_1,q_80,w_1200/528921d68e92e2f58a2df4f970965b86.jpg"
The top 10 business schools for career growth,Pursuing a Master of Business Administration (MBA) can be a powerful investment for career development.Read more...,https://qz.com/top-10-mba-programs-globally-linkedin-report-1851640783,"https://i.kinja-img.com/image/upload/c_fill,h_675,pg_1,q_80,w_1200/e2d9b952fff06c3dac7da840ee596e33.jpg"
Storey and Sandilands take GB to 38 golds in Paris,"A round-up of what has happened so far on day nine at the 2024 Paralympics, with Great Britain already winning three medals.",https://www.bbc.com/sport/articles/clynje4yjjxo,https://ichef.bbci.co.uk/news/1024/branded_sport/1d66/live/70a178d0-6c3d-11ef-8589-49d352db8330.png
Adani Plans $10 Billion India Chip Plant With Israel’s Tower,"(Bloomberg) -- Sign up for the India Edition newsletter by Menaka Doshi – an insider's guide to the emerging economic powerhouse, and the billionaires and...",https://finance.yahoo.com/news/adani-plans-10-billion-india-075728828.html,https://s.yimg.com/ny/api/res/1.2/oL6bVmDg.k2fCopA.5n8Jw--/YXBwaWQ9aGlnaGxhbmRlcjt3PTEyMDA7aD04MDA-/https://media.zenfs.com/en/bloomberg_technology_68/289d36555d03802182b8b9c08d7a00bd
What killing of Hindu teen by India cow vigilantes tells us about Modi 3.0,"What happens when the vigilantes 'mistakenly' shoot a Hindu teenager dead after a 40km chase, thinking he was a Muslim?",https://www.aljazeera.com/news/2024/9/6/what-killing-of-hindu-teen-by-india-cow-vigilantes-tells-us-about-modi-3-0,https://www.aljazeera.com/wp-content/uploads/2023/07/2017-11-06T120404Z_1750438941_RC16194CB200_RTRMADP_3_INDIA-POLITICS-RELIGION-COWS-1689844431.jpg?resize=1920%2C1440
"Russia-Ukraine war: List of key events, day 924","As the war enters its 924th day, these are the main developments.",https://www.aljazeera.com/news/2024/9/6/russia-ukraine-war-list-of-key-events-day-924,https://www.aljazeera.com/wp-content/uploads/2024/09/AFP__20240905__36FD9CC__v1__HighRes__UkraineRussiaConflictWar-1725582495.jpg?resize=1200%2C630
vivo T3 Ultra's launch date and design officially revealed,"vivo unveiled the vivo T3 Pro last week in India, which will be joined by the vivo T3 Ultra next week on September 12.

The vivo T3 Ultra will come with ""advanced performance and imaging capabilities,"" and it will be sold through vivo's Indian website, Flipka…",https://www.gsmarena.com/vivo_t3_ultra_launch_date_design-news-64435.php,https://fdn.gsmarena.com/imgroot/news/24/09/vivo-t3-ultra-launch-date/-952x498w6/gsmarena_001.jpg
Motorola is already working on the Razr 50s,"Motorola's Razr 50 and Razr 50 Ultra arrived on the global stage back in June, and the former is due to land in India on September 9. Now though it's been revealed that Motorola is already working on a new Razr that will kind of be part of the same family.

W…",https://www.gsmarena.com/motorola_is_already_working_on_the_razr_50s-news-64432.php,https://fdn.gsmarena.com/imgroot/news/24/09/motorola-razr-50s-surfaces/-952x498w6/gsmarena_000.jpg
Fun Trailer for 'Superboys of Malegaon' Filmmaking Comedy from India,"""We all need comedy and some laughter in life."" Amazon MGM Studios has revealed an official trailer for a comedy from India called Superboys of Malegaon, which will be premiering at the 2024 Toronto Film Festival underway now. The meta comedy is about a wanna…",https://www.firstshowing.net/2024/fun-trailer-for-superboys-of-malegaon-filmmaking-comedy-from-india/,https://media2.firstshowing.net/firstshowing/img16/SuperboysMalegonPosterbigTW1.jpg
CON THE CON: Santos in court as scammer admits trying to trick him out of $900K!,NEW YORK — Convicted con man and ex-congressman George Santos sat in a Brooklyn courtroom Thursday and watched another con artist admit to a harebrained...,https://www.nydailynews.com/2024/09/05/george-santos-looks-on-in-brooklyn-court-as-scammer-admits-trying-to-trick-him-out-of-900k/,https://s.yimg.com/cv/apiv2/social/images/yahoo_default_logo-1200x1200.png
"Aruna Vasudev, Asian Cinema Stalwart, Dies Aged 88","Aruna Vasudev, a champion of Asian cinema and Network for the Promotion of Asian Cinema (NETPAC) founder, passed away on September 5 at the age of 88. Born in India, Vasudev pursued photography in New York, before completing a doctorate in cinema in Paris. Sh…",http://deadline.com/2024/09/aruna-vasudev-dead-asian-cinema-stalwart-1236077182/,https://deadline.com/wp-content/uploads/2024/09/Aruna-Vasudev-2.jpg?w=1024
La condición que pone Putin para entrar en una negociación de paz con Zelenski,Durante las negociaciones de 2022 se negociaba la neutralidad de Ucrania y la cesión de territorios ocupados.,https://www.20minutos.es/noticia/5630993/0/putin-aprovecha-los-cambios-gobierno-zelenski-para-insistir-una-negociacion-con-ucrania-bajo-acordado-estambul/,https://imagenes.20minutos.es/files/image_1920_1080/uploads/imagenes/2024/09/05/el-presidente-ruso-vladimir-putin-en-la-sesion-plenaria-del-foro-economico-oriental.jpeg
Links 9/6/2024,Our joyful daily links,https://www.nakedcapitalism.com/2024/09/links-9-6-2024.html,https://www.nakedcapitalism.com/wp-content/uploads/2024/09/bibi_map.png
"First Sweden, Now Brazil: Digital Crime is Exploding in Two of the World’s Most Cashless Economies","""Criminal groups are migrating from physical to virtual crimes because it is a better, more lucrative and less risky business.""",https://www.nakedcapitalism.com/2024/09/first-sweden-now-brazil-digital-crime-is-exploding-in-the-worlds-most-cashless-economies.html,
Breaking down ESPN’s decision to use AI to write some game stories,"ESPN made a major announcement on Thursday. The sports media giant announced it would implement artificial intelligence to write game recap stories for the Premier Lacrosse League and National Women’s […]
The post Breaking down ESPN’s decision to use AI to wr…",https://www.poynter.org/commentary/2024/espn-artificial-intelligence-pll-nwsl-coverage/,https://www.poynter.org/wp-content/uploads/2024/09/unnamed-31.png
Is Facebook Still King? 11 Facebook Stats You Need To Know,"Discover the latest Facebook stats that reveal the platform's dominance in the digital world, including user growth, mobile engagement, and global reach in 2024
The post Is Facebook Still King? 11 Facebook Stats You Need To Know appeared first on jeffbullas.c…",https://www.jeffbullas.com/facebook-stats/,https://www.jeffbullas.com/wp-content/uploads/2024/09/DALL·E-2024-09-06-15.55.28-A-feature-image-showing-Facebooks-global-dominance-in-the-digital-world.-The-image-includes-a-large-iconic-blue-Facebook-logo-positioned-like-a-crow-e1725618453674.webp
"China Market Update: Typhoon Gives Hong Kong Three-Day Weekend, Week In Review",Asian equities were largely lower as Thailand and Taiwan outperformed while India was a rare underperformer.,https://www.forbes.com/sites/brendanahern/2024/09/06/china-market-update-typhoon-gives-hong-kong-three-day-weekend-week-in-review/,https://imageio.forbes.com/specials-images/imageserve/66db2038bcee66d158835a77/0x0.jpg?format=jpg&height=900&width=1600&fit=bounds
"After Four Decades, IBM Decides To Leave China","Management says that costs and risks have risen, while business prospects in that economy simply are not what they once were.",https://www.forbes.com/sites/miltonezrati/2024/09/06/after-four-decades-ibm-decides-to-leave-china/,https://imageio.forbes.com/specials-images/imageserve/66db4966afd8d7aa3eef410b/0x0.jpg?format=jpg&height=900&width=1600&fit=bounds
Scientists Say ‘Lost Birds List’ Will Help Protect Species,"The first comprehensive list of birds that haven’t been seen or heard in more than a decade, reported by citizen scientists, has been released by scientists.",https://www.forbes.com/sites/grrlscientist/2024/09/06/scientists-say-lost-birds-list-will-help-protect-species/,"https://imageio.forbes.com/specials-images/imageserve/66db0b330121813588b9a89d/0x0.jpg?format=jpg&crop=2880,1620,x0,y300,safe&height=900&width=1600&fit=bounds"
The Art And Science Of Revamping Rewards Strategies,"As benefits teams contend with multiple disruptions and changing employee needs, redesigning total rewards packages may be crucial.",https://www.forbes.com/councils/forbeshumanresourcescouncil/2024/09/06/the-art-and-science-of-revamping-rewards-strategies/,https://imageio.forbes.com/specials-images/imageserve/66d9d7dcb6a0e7ee62421bca/0x0.jpg?format=jpg&height=900&width=1600&fit=bounds
Quantifying The Unquantifiable: The Value Of Emotion In Branding,Understanding the emotional motivators that drive consumer behavior can significantly enhance how brands engage with their audiences.,https://www.forbes.com/councils/forbescommunicationscouncil/2024/09/06/quantifying-the-unquantifiable-the-value-of-emotion-in-branding/,https://imageio.forbes.com/specials-images/imageserve/66d9e1f783754f1fb9918e54/0x0.jpg?format=jpg&height=900&width=1600&fit=bounds
Grocery Tech Trends: Getting More From In-Store,Retailers are challenging the status quo by not only enhancing their online experiences but also integrating digital technology into in-store shopping.,https://www.forbes.com/councils/forbesbusinesscouncil/2024/09/06/grocery-tech-trends-getting-more-from-in-store/,https://imageio.forbes.com/specials-images/imageserve/611bc9e2b0db5726688472f8/0x0.jpg?format=jpg&height=900&width=1600&fit=bounds
F1 Title Pursuit Goes Global Via Tata Communications Innovation,"Tata Communications helps power Formula 1's global reach with innovative streaming tech, supporting a record-breaking 24-race season and enhancing the fan experience.",https://www.forbes.com/sites/leeigel/2024/09/06/f1-title-pursuit-goes-global-via-tata-communications-innovation/,https://imageio.forbes.com/specials-images/imageserve/66db26940e1aff7f5f8e5a88/0x0.jpg?format=jpg&height=900&width=1600&fit=bounds
My Secret Weapon For Calling The Top In NVDA,"While everyone else was cheering Nvidia’s (NVDA) stock back to new heights this week, I called the top for the stock first thing Monday August 26th.",https://www.forbes.com/sites/greatspeculations/2024/09/06/my-secret-weapon-for-calling-the-top-in-nvda/,https://imageio.forbes.com/specials-images/imageserve/66db4b72d89d06dea81126ac/0x0.jpg?format=jpg&height=900&width=1600&fit=bounds
Inquinamento globale da plastica: il 13% viene dispersa nell'ambiente,52 milioni di tonnellate di rifiuti di plastica vengono dispersi nellambiente ogni anno e corrisponde a circa il 13% di tutto il materiale plastico prodotto annualmente nel mondo.,https://www.hdblog.it/green/articoli/n591773/inquinamento-globale-rifiuti-plastica/,https://hd2.tudocdn.net/1187473?w=1920
Mobile Tech Quiz 1: the results,"We’re excited to introduce a fun and super-casual quiz game that’s all about our favorite topic – mobile tech! Whether you’re a hardcore techie or just love staying in the loop, this is your chance to test your knowledge, learn something new, and have a blast…",https://www.phonearena.com/news/Mobile-Tech-Quiz-1-the-results_id161980,https://m-cdn.phonearena.com/images/article/161980-wide-two_1200/Mobile-Tech-Quiz-1-the-results.jpg
Reply AI Film Festival: i vincitori della prima edizione del festival dedicato ai corti originali realizzati con l’Intelligenza Artificiale (AI),"Annunciati i vincitori della prima edizione del Reply AI Film Festival per corti realizzati con l’Intelligenza Artificiale (AI) - Premiati “To Dear Me” di Gisele Tong, “One Way” di Egor Kharlamov e “Jinx”, di Mansha Totla.",https://www.cineblog.it/post/reply-ai-film-festival-vincitori-corti-intelligenza-artificiale,https://www.blogo.it/app/uploads/sites/3/2024/09/reply-ai-film-festival-i-vincitori-della-prima-edizione-del-festival-dedicato-ai-corti-originali-realizzati-con-lintelligenza-artificiale-ai-1.jpg
Samsung now manufactures AI home appliances in India,"Borrowing a page from its mobile business in India, Samsung has announced that several Bespoke home appliances with AI capabilities are now manufactured locally under the Made in India initiative. Through transitioning to local manufacturing, Samsung aims to …",https://www.sammobile.com/news/samsung-manufactures-ai-home-appliances-india/,https://www.sammobile.com/wp-content/uploads/2024/09/Samsung-Bespoke-AI-Laundry-Combo-720x405.jpg
10 of Area’s Best Looks in Honor of the Brand’s 10th Anniversary,"For NYFW, Area designer Piotrek Panszczyk revisits ten looks in honor of the brand’s tenth anniversary, including Taylor Swift’s Super Bowl Jeans, Rihanna’s fur bra, Beyoncé’s crystal knit cape, and more.",http://www.thecut.com/article/area-10-year-anniversary-nyfw.html,https://pyxis.nymag.com/v1/imgs/1e9/e6f/8a70677b7b15232deb6a967c4ca53df340-area-lede-2.1x.rsocial.w1200.jpg
Spyware Vendors' Nebulous Ecosystem Helps Them Evade Sanctions,"The secret web of at least 435 entities across 42 countries making up the spyware landscape facilitates unpunished security and human rights violations, the Atlantic Council found",https://www.infosecurity-magazine.com/news/spyware-ecosystem-evade-sanctions/,https://assets.infosecurity-magazine.com/webpage/og/37d77b82-5b4b-4f8c-b541-cea9d1f90146.jpg
„Lässt das Publikum enttäuscht zurück“: Horrorfilm erntet trotz Netflix-Chartplatzierung Kritik,Das Horror-Genre erfreut sich im Streaming oftmals großer Popularität. Nun reiht sich ein jüngst erschienener Genrevertreter trotz miesen Kritiken auf Platz 1 auf Netflix ein.,https://www.kino.de/film/the-deliverance-2024/news/laesst-das-publikum-enttaeuscht-zurueck-horrorfilm-erntet-trotz-netflix-chartplatzierung-kritik/,https://crops.giga.de/aa/53/16/d973159acb1662b3ab703748df_YyAyMTA2eDExODUrMTgrOQJyZSAxOTIwIDEwODADYTNkMzliNjM3N2Q=.jpg
China Ramping Renewables & Slamming Brakes On Coal Could Mean Massive CO2 Reductions By 2030,"Coal generation in China continues to fascinate the world, and for good reason. Last year’s emissions from that source alone were in the range of 6.1 billion tons of carbon dioxide, over double global aviation and shipping emissions combined. The big headline…",https://cleantechnica.com/2024/09/05/china-ramping-renewables-slamming-brakes-on-coal-could-mean-massive-co2-reductions-by-2030/,https://cleantechnica.com/wp-content/uploads/2024/09/DALL·E-2024-09-05-17.05.48-A-panoramic-view-of-a-decommissioned-Chinese-coal-plant-facility-transformed-into-a-renewable-energy-site.-The-large-industrial-structure-of-the-old-.webp
"In Six Years, Australia has doubled its Renewable Energy, and 36% of Households have Rooftop Solar","Ann Arbor (Informed Comment) - Australia's Climate Council has issued a new report on clean energy in the country's states. Winter is ending in Australia, but it is worrisome that their August was among the hottest on record this year, presaging a hot dry sum…",https://www.juancole.com/2024/09/australia-renewable-households.html,https://media.juancole.com/images/2024/09/IMG_3994.jpg
US slaps anti-Russia sanctions on Indian firms,Washington has sanctioned Indian-based companies it claims are linked to Russia’s Arctic LNG 2 project Read Full Article at RT.com,https://www.rt.com/india/603599-us-slaps-anti-russia-sanctions-india/,https://mf.b37mrtl.ru/files/2024.09/article/66daa3ac20302778e220cd37.jpeg
Western financial policies driving countries away from dollar – expert,"De-dollarization is the result of destructive practices by the US and IMF, according to Sichuan University Professor Huang Yunsong Read Full Article at RT.com",https://www.rt.com/business/603636-west-policies-drive-de-dollarization/,https://mf.b37mrtl.ru/files/2024.09/article/66db1e6f2030272b723e3214.jpg
Marvel Has Already Cast Its Perfect Thor Replacement According To Strong MCU Theory,A new MCU theory suggests that Thor: Love and Thunder may have presented Marvel Studios with the perfect opportunity to replace Thor in the MCU.,https://screenrant.com/marvel-mcu-thor-love-replacement-theory/,https://static1.srcdn.com/wordpress/wp-content/uploads/2024/09/thor-and-the-corrupted-gorr-in-the-mcu.jpg
JLR to launch new Indian-built model that sits on Tata platform,"Architecture will also underpin ""high-end"" Tata model; both cars will be exported to other markets

A new Indian-built JLR model based on a new platform being created by parent firm Tata Motors will be launched next year. 

Confirmed by Tata Group boss Natar…",https://www.autocar.co.uk/car-news/new-cars/jlr-launch-new-indian-built-model-sits-tata-platform,https://www.autocar.co.uk/sites/autocar.co.uk/files/images/car-reviews/first-drives/legacy/rrevq20mytrimfinal14031914.jpg
K-Pop Statistics — Top Artists and Trends in 2024,"If these K-pop statistics are anything to go by, the formerly niche music genre is taking the world by storm. Its appeal is largely due to the combination of funky...
The post K-Pop Statistics — Top Artists and Trends in 2024 appeared first on The Tech Report.",https://techreport.com/?p=3565805,https://techreport.com/wp-content/uploads/2024/09/Kpop-Statistics.png?_t=1725633507
Un potente ciclón podría afectar al iPhone 16,"A pocos días para el inicio de la keynote en la que se conocerán todas las novedades del iPhone 16, el riesgo de una situación que podría afectar la producción del dispositivo estrella de Apple parece inminente. China y Taiwán, epicentros de la producción ele…",https://ipadizate.com/iphone/un-potente-ciclon-podria-afectar-al-iphone-16,https://ipadizate.com/hero/2024/09/iphone-16.1725632385.2547.jpg?width=1200
Dravid unveiled as Rajasthan Royals head coach,Former India coach has signed a multi-year contract with the franchise,https://www.espncricinfo.com/story/rahul-dravid-unveiled-as-rajasthan-royals-head-coach-1450060,https://img1.hscicdn.com/image/upload/f_auto/lsci/db/PICTURES/CMS/387000/387087.6.jpg
US Air Force Deploys More Stealth Jets to Southeast Asia,"U.S. F-35s and F-22s have toured Southeast Asia twice this year, reflecting an American desire to increase training exercises with nations in the vicinity of the South China Sea.",https://thediplomat.com/2024/09/us-air-force-deploys-more-stealth-jets-to-southeast-asia/,https://thediplomat.com/wp-content/uploads/2024/09/sizes/td-story-s-2/thediplomat_2024-09-05-223020.jpg
Arakan Army Commander-in-Chief Twan Mrat Naing on the Future of Rakhine State,"“We are always in favor of repatriation [of Rohingya Muslims] in principle, and there should be voluntary, dignified, and safe repatriation under conducive conditions.”",https://thediplomat.com/2024/09/arakan-army-commander-in-chief-twan-mrat-naing-on-the-future-of-rakhine-state/,https://thediplomat.com/wp-content/uploads/2024/09/sizes/td-story-s-2/thediplomat_2024-09-06-112844.jpg
[Removed],[Removed],https://removed.com,
[Removed],[Removed],https://removed.com,
[Removed],[Removed],https://removed.com,
[Removed],[Removed],https://removed.com,
[Removed],[Removed],https://removed.com,
[Removed],[Removed],https://removed.com,
"Albuquerque Museum Presents Broken Boxes: A Decade of Art, Action, and Dialogue","A groundbreaking, podcast-inspired exhibition in New Mexico celebrates the artwork and ideas of 23 revolutionary artists of our time.",http://hyperallergic.com/948083/broken-boxes-a-decade-of-art-action-and-dialogue-albuquerque-museum/,https://i0.wp.com/hyperallergic-newspack.s3.amazonaws.com/uploads/2024/09/CannupaHanskaLuger_BloodLust_photobyTiaFoundation-e1725483647701.jpg?fit=2400%2C1344&quality=95&ssl=1
Quanto costeranno i nuovi modelli di iPhone 16?,"Quanto costeranno i nuovi modelli di iPhone 16?

Con l’imminente lancio della serie iPhone 16, Apple si prepara a competere in un mercato degli smartphone in continua evoluzione. Sebbene ci siano diverse voci che anticipano notevoli aggiornamenti, si specula …",https://www.ispazio.net/2074546/quanto-costeranno-nuovi-iphone-16,https://www.ispazio.net/wp-content/uploads/2024/09/prezzi-modelli-iphone-16-ispazio.jpg
