title,description,url,urlToImage
Israel's Tower Semiconductor ties up with Adani group for $10 billion chip project in India,Israel's Tower Semiconductor and Adani Group will invest 839.47 billion rupees ($10.01 billion) for a semiconductor project in India's western state of...,https://finance.yahoo.com/news/israels-tower-semiconductor-ties-adani-072317468.html/,https://s.yimg.com/cv/apiv2/social/images/yahoo_default_logo.png
"Exclusive-India to tighten derivatives rules despite investor pushback, sources say"https://consent.yahoo.com/v2/collectConsent?sessionId=1_cc-session_22eadcb2-780e-49f0-b487-2e9dfec479ec,
"Exclusive-Russia raises forecast for 2024 oil, gas export revenues by $17.4 billion, document shows","Russia's economy ministry has revised up its 2024 forecasts for export sales of oil and gas, key sources of budget revenues, by $17.4 billion from the...",https://finance.yahoo.com/news/exclusive-russia-raises-forecast-2024-180317160.html,https://media.zenfs.com/en/reuters-finance.com/cf679dd72bf5d5ef14d8043d58fdb376
FDA Battles Backlog of Drug Factory Inspections Since COVID-19,"Federal regulators are grappling with a significant backlog of factory inspections for drug manufacturing, with many facilities not reviewed since before the...",https://finance.yahoo.com/news/fda-battles-backlog-drug-factory-155251379.html,https://media.zenfs.com/en/Benzinga/3faac7171d10e36b5852c42209cc1769
Russia-linked GRU Unit 29155 targeted critical infrastructure globally,"The United States and its allies state that Russia-linked threat actors operating under the GRU are behind global critical infrastructure attacks. The FBI, CISA, and NSA linked threat actors from Russia’s GRU Unit 29155 to global cyber operations since at lea…",https://securityaffairs.com/168095/cyber-warfare-2/russia-gru-unit-29155-critical-infrastructure.html,https://securityaffairs.com/wp-content/uploads/2016/12/Consular-Department-of-the-Embassy-of-the-Russian-Federation.jpg
SonicWall warns that SonicOS bug exploited in attacks,"Recently fixed access control SonicOS vulnerability, tracked as CVE-2024-40766, is potentially exploited in attacks in the wild, SonicWall warns. SonicWall warns that a recently fixed access control flaw, tracked as CVE-2024-40766 (CVSS v3 score: 9.3), in Son…",https://securityaffairs.com/168112/hacking/sonicwall-sonicos-bug-exploited.html,https://securityaffairs.com/wp-content/uploads/2020/10/SonicWall.png
Apache fixed a new remote code execution flaw in Apache OFBiz,"Apache addressed a remote code execution vulnerability affecting the Apache OFBiz open-source enterprise resource planning (ERP) system. Apache fixed a high-severity vulnerability, tracked as CVE-2024-45195 (CVSS score: 7.5) affecting the Apache OFBiz open-so…",https://securityaffairs.com/168106/security/apache-ofbiz-rce-cve-2024-45195.html,https://securityaffairs.com/wp-content/uploads/2021/03/Apache-OFBiz.png
What Do I Do With Okra?,"Okra, the warm-weather plant with versatile seed pods, can be used in soups like gumbo, pickled, added to salads, and more.",https://www.eater.com/24236196/how-to-use-okra-salad-soup-pickle-recipe-ideas,https://cdn.vox-cdn.com/thumbor/JjW71P7bx9US2qtousUJzD7Dm_s=/0x31:1600x869/fit-in/1200x630/cdn.vox-cdn.com/uploads/chorus_asset/file/25604103/Okra_Final.jpg
India to boost exports of alcoholic beverages,"‘Make in India’ liquor has huge global potential, New Delhi believes Read Full Article at RT.com",https://www.rt.com/india/603640-india-to-boost-exports-of-alcohol/,https://mf.b37mrtl.ru/files/2024.09/article/66db2f7985f54016617d2c46.jpg
India turns to Singapore for ‘inspiration’ to boost semiconductors,The move is seen as a major stride for New Delhi’s efforts to boost its chip industry Read Full Article at RT.com,https://www.rt.com/india/603620-india-turns-to-singapore/,https://mf.b37mrtl.ru/files/2024.09/article/66dad76585f54003f163235e.jpeg
UPSC Geo-Scientist Recruitment Examination 2025,"UPSC Geo-Scientist Recruitment Examination 2025
Union Public Service Commission  (UPSC), Shahjahan Road, Dholpur House, New Delhi – 110069 will hold a Combined Geo-Scientist (Preliminary) Examination, 2025 (Computer Based Test) on 09/02/2025 for selection to …",https://www.sarkarinaukriblog.com/2024/09/upsc-geo-scientist-recruitment.html,https://blogger.googleusercontent.com/img/b/R29vZ2xl/AVvXsEh_j2H0O7p1_3AA1o-_Cy9I1h6MoL_RUVyt62n4tktdi93mV_vFVCbHL_-SlqKxEbha-Zmkyd2-E0oU2VlaWpcoXLWPhXvMf3q9QPVeBLDBslx0lKVbntd04OmYoDAI0X-ufWo4VkQB72EPFxgtRlZNzkYsqya_dEK2jNm6cya_QmeOircy--xD/w1200-h630-p-k-no-nu/UPSC-Geo-Scientist-Geologist-Examination.webp
"Cathay Pacific: San Francisco – Mumbai, India. $776. Roundtrip, including all Taxes","A good sale to MumbaiSample Travel Date:January 23rd - 30th, 2025This is just ONE SAMPLE travel date, for more availability, please follow the ""Fare Availability"" and """,https://www.theflightdeal.com/2024/09/06/cathay-pacific-san-francisco-mumbai-india-776-roundtrip-including-all-taxes/,https://www.theflightdeal.com/wp-content/uploads/2017/07/mumbai_india_july-640x390.jpg
"Malaysia can play key role in bringing Asean media houses together, says Fahmi","KUALA LUMPUR: Malaysia can bring regional media houses together for closer collaboration ahead of the country assuming the Asean chairmanship next year, says Communications Minister Fahmi Fadzil. Read full story",https://www.thestar.com.my/news/nation/2024/09/06/malaysia-can-play-key-role-in-bringing-asean-media-houses-together-says-fahmi,https://apicms.thestar.com.my/uploads/images/2024/09/06/2898770.JPG
PM Anwar’s working visit to Vladivostok a major boost to Malaysia-Russia ties,VLADIVOSTOK (Russia): Prime Minister Datuk Seri Anwar Ibrahim’s two-day working visit here is a major boost for bilateral ties between Malaysia and Russia. Read full story,https://www.thestar.com.my/news/nation/2024/09/06/pm-anwars-working-visit-to-vladivostok-a-major-boost-to-malaysia-russia-ties,https://apicms.thestar.com.my/uploads/images/2024/09/06/2898561.png
"GOODBYE, WEST: India considers using Russia’s SWIFT alternative for trade settlements",Dedollarization efforts are moving forward as the Reserve Bank of India (RBI) considers joining the new System for Transfer of Financial Messages (SPSF) settlement system created by Russia after the Belgium-based SWIFT network banned Russia from participation…,https://www.naturalnews.com/2024-09-06-india-considers-russia-swift-alternative-trade-settlements.html,https://www.naturalnews.com/wp-content/uploads/sites/91/2024/09/Barter-Trade.jpg
Turkey submits request to join BRICS group of nations,"Turkey has submitted a formal request to join the BRICS group of nations. Sources told Bloomberg News that Ankara “seeks to bolster its global influence and forge new ties beyond its traditional Western allies.” According to them, Turkish President Recep Tayy…",https://www.naturalnews.com/2024-09-06-turkey-submits-request-to-join-brics-group.html,https://www.naturalnews.com/wp-content/uploads/sites/91/2024/09/turkey-219694_960_720.jpg
"Missed Fists: Fighter opens with Max Holloway taunt, instantly scores knockout","A big man channels Max Holloway to great success, brutal knockouts from India and South Korea, a pair of incredible spinning kicks, and more in this edition of Missed Fists.",https://www.mmafighting.com/2024/9/6/24237435/missed-fists-mac-papalii-opens-with-max-holloway-taunt-instantly-scores-knockout,https://cdn.vox-cdn.com/thumbor/gC5BOqcqLyJAzuIUWYttuxCTtBM=/0x0:1155x605/fit-in/1200x630/cdn.vox-cdn.com/uploads/chorus_asset/file/25606798/mfholloway.jpg
India's far-right Hindus seek to drive Muslims out of 'holy land',"A year after extremists forced Muslim neighbors from their homes in India, victims live in despair as their tormentors seek to drive Islam from what they consider a Hindu ""holy land"".Mohammad Salim shudders when he remembers the campaign that erupted in May 2…",https://www.rawstory.com/india-s-far-right-hindus-seek-to-drive-muslims-out-of-holy-land/,https://www.rawstory.com/media-library/hardline-hindu-nationalist-rakesh-tomar-r-celebrated-the-departure-of-muslims-from-purola-asma-hafiz.png?id=53596546&width=1200&height=600&coordinates=0%2C0%2C0%2C144
Neo-Ottoman NATO Member Turkey in BRICS? Is It Really a Good Idea?,"Joining BRICS is all the rage nowadays. Dozens of countries have shown interest to join what’s almost certainly the world’s only true international organization. 
The UN has long been an instrument of “legitimizing” the US-led political West’s perpetual aggre…",https://www.globalresearch.ca/turkey-brics-good-idea/5867278,https://www.globalresearch.ca/wp-content/uploads/2024/09/Turkey-nato-brics.jpeg
Gaza’s Polio Vaccine Project: Bill Gates comes to the Rescue of Palestinian Children. Can you Trust Him?,"The first thing which was denied to Palestinians was water and food. It was the onslaught of the genocide against the People of Palestine. 
Netanyahu ordered a complete blockade of the Gaza Strip starting on October 9, 2023, preventing and …
The post Gaza’s P…",https://www.globalresearch.ca/gazas-polio-vaccine-project-bill-gates-comes-to-the-rescue-of-palestinian-children-can-you-trust-him/5867225,https://www.globalresearch.ca/wp-content/uploads/2024/09/netanyahu-bill-gates.jpeg
"Candidates From Djibouti, Kenya, Madagascar and Mauritius Contesting for African Union Chairperson’s Position","The African Union Chairperson is an important position within the African Union. The Chairperson serves as the head of the (AU) African Union elected by the assembly of heads of states and government. As the Africa Union stands at the …
The post Candidates Fr…",https://www.globalresearch.ca/djibouti-kenya-madagascar-mauritius-auc-chairpersons/5867166,https://www.globalresearch.ca/wp-content/uploads/2024/09/Raila-Odinga-Candidate-for-African-Union-Chairperson..jpg
Empecé a usar VPN en mi Chromecast y ahora puedo ver más contenidos que antes,"Ya estamos algo familiarizados con el uso de VPN en el ordenador y de sus potenciales beneficios. Incluso también con las ventajas de usarlas en el móvil. Pero las VPN son aplicables también a otros dispositivos, como puede ser el Chromecast en nuestra Smart …",https://www.adslzone.net/noticias/streaming-tv/vpn-chromecast-contenidos-ver/,https://www.adslzone.net/app/uploads-adslzone.net/2024/09/chromecastvpn.jpg
Elsa Pataky se rinde a Chris Hemsworth en el Día del Padre en Australia: «Casi perfecto»,"Pocas parejas parecen tan sólidas y cariñosas en el mundo del cine como la que forman la española Elsa Pataky y el australiano Chris Hemsworth . La actriz, madre de tres hijos, compartió un carrusel en su Instagram en el que rindió homenaje a su esposo en el …",https://www.abc.es/gente/elsa-pataky-rinde-chris-hemsworth-dia-padre-20240906114543-nt.html,https://s1.abcstatics.com/abc/www/multimedia/gente/2024/09/06/elsa-pataky-chris-hemsworth-dia-del-padre-australia-casi-perfecto-U20346663276HVO-1024x512@diario_abc.jpg
"Acer hits record highs in India, Indonesia","The president of Acer's Pan-Asia Pacific operations, Andrew Hou, pointed out that irresistible momentum in India and Indonesia, coupled with a rebound in business PC sales, has offset the sluggish consumer PC market. Notably, India has achieved Acer’s best sa…",https://www.digitimes.com/news/a20240906PD203/acer-india-indonesia-business-market-share.html,https://img.digitimes.com/newsshow/20240906pd203_files/4_b.jpg
"India needs 10-20 wafer fabs, says SEMI CEO","As SEMICON India 2024 approaches, SEMI CEO Ajit Manocha has called on India to invest in building more semiconductor fabs. With global investors increasingly interested in India, Manocha emphasizes the need to enhance the country's semiconductor supply chain …",https://www.digitimes.com/news/a20240905VL201/india-semiconductor-industry-supply-chain-talent-semi.html,https://img.digitimes.com/newsshow/20240905vl201_files/2_2b.jpg
Mapping heavy mineral deposits on the coast of the state of Rio Grande do Sul (Brazil) using orbital and proximal remote sensing,"Heavy mineral deposits occur in several coastal areas of the world, formed over a long period due to variations in mean sea level, wave action, and winds. These are the main sources of ilmenite (FeTiO3), which in turn is the source of more than 80% of the TiO…",https://journals.plos.org/plosone/article?id=10.1371/journal.pone.0309043,https://journals.plos.org/plosone/article/figure/image?id=10.1371/journal.pone.0309043.g007&size=inline
"Knowledge, attitude, practice and associated factors of oxygen therapy among health professionals in Ethiopia: A systematic review and meta-analysis","Background Oxygen therapy is a life-saving intervention used in various healthcare settings to maintain adequate tissue oxygenation while minimizing cardiopulmonary work. Its effective and safe administration depends largely on the knowledge, attitudes, and p…",https://journals.plos.org/plosone/article?id=10.1371/journal.pone.0309823,https://journals.plos.org/plosone/article/figure/image?id=10.1371/journal.pone.0309823.g005&size=inline
Does overconfident CEO lead to corporate environmental misconducts? Evidence from China,"Enterprises are drawing growing criticism for violating environmental rules. The research examines whether and how top executives’ mental bias leads to corporate environmental misconduct (CEI). Drawing on upper echelon theory (UET) and agency theory, we link …",https://journals.plos.org/plosone/article?id=10.1371/journal.pone.0309957,https://journals.plos.org/plosone/article/figure/image?id=10.1371/journal.pone.0309957.g003&size=inline
Expression patterns of candidate genes for the Lr46/Yr29 “slow rust” locus in common wheat (Triticum aestivum L.) and associated miRNAs inform of the gene conferring the Puccinia triticina resistance trait,"Leaf rust caused by Puccinia triticina (Pt) is one of the most impactful diseases causing substantial losses in common wheat (Triticum aestivum L.) crops. In adult plants resistant to Pt, a horizontal adult plant resistance (APR) is observed: APR protects the…",https://journals.plos.org/plosone/article?id=10.1371/journal.pone.0309944,https://journals.plos.org/plosone/article/figure/image?id=10.1371/journal.pone.0309944.g006&size=inline
U.S. Military Contracts Are Restricting Repair,"Every week, we get a roundup of recent developments in Right to Repair news, courtesy of Paul Roberts from Fight to Repair, a reader-supported publication. Sign up to receive updates in your…",https://www.ifixit.com/News/99096/u-s-military-contracts-are-restricting-repair,https://valkyrie.cdn.ifixit.com/media/2024/09/05174733/tank_3x2.jpg
Family of raped and murdered Indian doctor claims police delayed investigation,"The victim’s parents, who can’t be named under an Indian law that protects the identity of sexual assault victims, said their grief is mixed with anger at how police have handled the high-profile case.",https://www.cbc.ca/news/kolkata-doctor-raped-killed-family-police-1.7315310,https://i.cbc.ca/1.7315312.1725629732!/fileImage/httpImage/image.jpg_gen/derivatives/16x9_620/kolkata-protest.jpg
"Time to criminalize environmental damage, says survey","People across 22 countries are deeply concerned about the future of our planet, with over 70% wanting to make those who hurt nature and the climate pay a price.",https://www.dw.com/en/time-to-criminalize-environmental-damage-says-survey/a-70143258,https://static.dw.com/image/67507873_6.jpg
"“The engines can’t take it, captain” – A global Captain Kirk-like plea for more power gets Scotty’s standard line","Some aspects of humanity are just what they are, and we need to run in the same direction to change the direction of the herd. Go ahead and stand in front of it if you want, best of luck.",https://wattsupwiththat.com/2024/09/05/the-engines-cant-take-it-captain-a-global-captain-kirk-like-plea-for-more-power-gets-scottys-standard-line/,https://i0.wp.com/wattsupwiththat.com/wp-content/uploads/2024/09/SCOTTY-LLMS.webp?fit=1024%2C512&ssl=1
Feral Interactive Is Bringing The Classic 18th-Century Game Total War: Empire To Android!,"Later this year.
The post Feral Interactive Is Bringing The Classic 18th-Century Game Total War: Empire To Android! appeared first on Droid Gamers.",https://www.droidgamers.com/news/total-war-empire-android/,https://www.droidgamers.com/wp-content/uploads/2024/09/Total-War-EMPIRE-Android.jpg
India Wants to Dump Its Russian-Built T-72 Tanks,"Summary and Key Points: India is moving to replace its aging Soviet-era T-72 main battle tanks (MBTs) with indigenously developed vehicles under the Future Ready Combat Vehicle (FRCV) program.
-The Indian Ministry of Defence (MoD) has approved the decade-long…",https://nationalinterest.org/blog/buzz/india-wants-dump-its-russian-built-t-72-tanks-212619,https://nationalinterest.org/sites/default/files/main_images/T-72%20Tank.jpg
TAVE's “Difference Now” ft. Stacy Barthe and Runkus is a heartfelt ode to the islands,"TAVE invites you on a soulful journey in his new single, “Difference Now”, featuring the gorgeous vocal stylings of Stacy Barthe and reggae icon Runkus. This enchanting track features the…",https://earmilk.com/2024/09/06/taves-difference-now-ft-stacy-barthe-and-runkus-is-a-heartfelt-ode-to-the-islands/,
Un avion de pasageri indian a aterizat de urgenţă în Turcia după o ameninţare cu bombă,"Un zbor operat de compania indiană Vistara Airlines a aterizat de urgenţă vineri la Erzurum, în estul Turciei, după ce o bucată de hârtie pe care scria „bombă la bord” a fost găsită într-o toaletă, a declarat ministrul turc de interne Ali Yerlikaya, citat de …",https://www.mediafax.ro/externe/un-avion-de-pasageri-indian-a-aterizat-de-urgenta-in-turcia-dupa-o-amenintare-cu-bomba-22479758,https://storage0.dms.mpinteractiv.ro/media/1/1/3614/22479758/1/2608357-mediafax-foto-alex-drifter.jpg?width=640
World has hottest ever summer with Mediterranean hard hit,"<p>LONDON - This summer was the hottest ever in the Northern Hemisphere, putting the Earth on track for another record-breaking year.</p>",https://www.bangkokpost.com/world/2860611/world-has-hottest-ever-summer-with-mediterranean-hard-hit,https://static.bangkokpost.com/media/content/20240906/c1_2860611_700.jpg
